restaurant_id,restaurant_name,location_area,cuisine_type,price_range,avg_cost_for_two,ambience_type,overall_rating,popular_dishes,has_home_delivery,has_vegetarian_options,is_family_friendly,contact_number,address,opening_hours,years_in_business,total_reviews
1001,Haribhavanam,Gandhipuram,Kerala,$$,1713,Family-style,4.5,"Fish Curry, Kappa & Meen Curry",Yes,No,No,0422-230495,"617, Near Brookefields Mall, Gandhipuram, Coimbatore - 641013",11:00 AM to 10:00 PM,23,4514
1002,AB's Absolute Barbecues,Singanallur,Chinese,$,442,Casual,4.1,"Dumplings, Spring Rolls",Yes,Yes,No,0422-212676,"368, Main Road, Singanallur, Coimbatore - 641054",11:00 AM to 11:00 PM,26,405
1003,Cascade Cafe,Ukkadam,Andhra,$$,871,Casual,4.5,"Gutti Vankaya, Pulihora, Gongura Mutton, Pesarattu",Yes,Yes,No,0422-230512,"888, Main Road, Ukkadam, Coimbatore - 641022",10:00 AM to 11:00 PM,15,3038
1004,The Eatery Cafe,Peelamedu,South Indian,$$,967,Family-style,4.8,"Bisi Bele Bath, Vada",Yes,Yes,Yes,0422-228785,"333, Near Hope College, Peelamedu, Coimbatore - 641017",8:00 AM to 10:00 PM,26,2634
1005,Sree Gowri Shankar Sweet Shop,Gandhipuram,Chinese,$$,946,Casual,4.2,"Dumplings, Hot & Sour Soup, Schezwan Fried Rice",Yes,Yes,No,0422-276622,"920, Opposite Gandhipuram Bus Stand, Gandhipuram, Coimbatore - 641084",10:00 AM to 11:00 PM,8,1183
1006,Sree Annapoorna,Gandhipuram,Italian,$$,865,Casual,4.2,"Bruschetta, Garlic Bread",Yes,Yes,No,0422-272512,"697, Near Lakshmi Mills, Gandhipuram, Coimbatore - 641024",11:00 AM to 11:00 PM,25,2836
1007,KFC Kitchen,Saravanampatti,South Indian,$$,956,Casual,4.8,"Uttapam, Vada",No,Yes,Yes,0422-200074,"332, Near Kovai Medical Center, Saravanampatti, Coimbatore - 641072",7:00 AM to 10:00 PM,30,3023
1008,Haribhavanam Family Restaurant,Thudiyalur,Multi-Cuisine,$$$,2795,Traditional,4.7,"Thali, Dessert Platter",Yes,Yes,No,0422-286474,"487, Main Road, Thudiyalur, Coimbatore - 641080",8:00 AM to 11:00 PM,17,3516
1009,Barbeque Nation Bakery,Ramanathapuram,Arabian,$,361,Casual,4.0,"Kunafa, Hummus, Kebab, Mandi",No,No,Yes,0422-277128,"226, Main Road, Ramanathapuram, Coimbatore - 641010",7:00 AM to 12:00 AM,21,532
1010,Arya Bhavan Family Restaurant,Sitra,South Indian,$,778,Traditional,4.4,"Vada, Pongal, Rava Dosa",Yes,Yes,Yes,0422-253354,"195, Main Road, Sitra, Coimbatore - 641022",7:00 AM to 12:00 AM,14,2952
1011,The Eatery Mess,Singanallur,Chinese,$,398,Casual,4.0,"Hot & Sour Soup, Dumplings, Hakka Noodles, Manchurian",Yes,Yes,No,0422-232742,"896, Main Road, Singanallur, Coimbatore - 641019",10:00 AM to 12:00 AM,4,464
1012,Sree Annapoorna,Ukkadam,Kerala,$$$,2794,Family-style,4.2,"Malabar Parotta, Puttu Kadala",Yes,Yes,No,0422-200282,"400, Main Road, Ukkadam, Coimbatore - 641043",10:00 AM to 11:00 PM,14,4602
1013,Haribhavanam,Singanallur,Kerala,$$$$,3734,Casual,4.5,"Fish Curry, Kerala Sadya, Appam Stew, Beef Fry",Yes,Yes,Yes,0422-207455,"984, Main Road, Singanallur, Coimbatore - 641075",7:00 AM to 10:00 PM,3,4924
1014,Sree Gowri Shankar Family Restaurant,Vadavalli,South Indian,$$,1473,Family-style,3.4,"Idli Sambar, Filter Coffee",Yes,Yes,No,0422-293872,"322, Main Road, Vadavalli, Coimbatore - 641040",9:00 AM to 11:00 PM,5,2507
1015,Annapoorna Barbecue,Ramanathapuram,Chinese,$$,1318,Casual,3.5,"Manchurian, Hakka Noodles, Chilli Chicken, American Chopsuey",Yes,Yes,Yes,0422-248434,"292, Main Road, Ramanathapuram, Coimbatore - 641030",10:00 AM to 12:00 AM,23,2528
1016,Annapoorna Bakery,Kalapatti,Chettinad,$$$,2036,Traditional,4.2,"Karaikudi Mutton, Fish Fry",Yes,Yes,No,0422-227607,"735, Main Road, Kalapatti, Coimbatore - 641053",8:00 AM to 12:00 AM,21,2212
1017,Haribhavanam Cafe,RS Puram,Italian,$$$,3379,Casual,4.1,"Pizza Margherita, Carbonara, Lasagna",Yes,Yes,Yes,0422-292493,"575, Opposite PSG College, RS Puram, Coimbatore - 641011",7:00 AM to 10:00 PM,29,1271
1018,Dindigul Thalappakatti Grill,Vadavalli,Italian,$,760,Casual,4.3,"Tiramisu, Bruschetta, Pizza Margherita",Yes,Yes,Yes,0422-273385,"906, Main Road, Vadavalli, Coimbatore - 641062",11:00 AM to 12:00 AM,5,1989
1019,Dragon Gate Restaurant,Vilankurichi,Bakery & Cafe,$,381,Modern,3.8,"Tea, Donut, Croissant",No,Yes,Yes,0422-229154,"205, Main Road, Vilankurichi, Coimbatore - 641068",9:00 AM to 11:00 PM,27,1914
1020,Burger King Cafe,Saibaba Colony,South Indian,$$$$,6955,Family-style,3.8,"Rava Dosa, Filter Coffee, Bisi Bele Bath",Yes,Yes,Yes,0422-223405,"986, Near Lakshmi Mills, Saibaba Colony, Coimbatore - 641043",7:00 AM to 10:00 PM,20,3609
1021,Hotel Gowri Krishna Mess,Thudiyalur,North Indian,$,300,Family-style,4.8,"Biryani, Naan, Butter Chicken, Tandoori Chicken",Yes,Yes,Yes,0422-296605,"687, Main Road, Thudiyalur, Coimbatore - 641035",9:00 AM to 11:00 PM,3,2754
1022,Pizza Hut,Saibaba Colony,Chettinad,$$,1212,Family-style,4.1,"Kola Urundai, Pepper Chicken, Fish Fry",Yes,Yes,Yes,0422-249695,"767, Near Lakshmi Mills, Saibaba Colony, Coimbatore - 641032",11:00 AM to 12:00 AM,10,3376
1023,Anjappar,Gandhipuram,Italian,$$$,3183,Casual,4.5,"Tiramisu, Risotto, Bruschetta, Carbonara",Yes,Yes,Yes,0422-222241,"87, Near Brookefields Mall, Gandhipuram, Coimbatore - 641046",11:00 AM to 12:00 AM,21,2795
1024,Arya Bhavan,Gopalapuram,South Indian,$,323,Casual,3.6,"Pongal, Masala Dosa",Yes,Yes,No,0422-254321,"908, Main Road, Gopalapuram, Coimbatore - 641090",11:00 AM to 10:00 PM,23,3195
1025,Annapoorna Mess,RS Puram,Chinese,$$$,3225,Family-style,4.3,"Spring Rolls, Dumplings",No,Yes,Yes,0422-259829,"821, Near Race Course, RS Puram, Coimbatore - 641069",11:00 AM to 12:00 AM,20,2649
1026,Hotel Gowri Krishna Grill,Kovaipudur,Mexican,$$$,2330,Traditional,4.4,"Quesadilla, Burritos, Enchiladas, Guacamole",Yes,Yes,Yes,0422-263517,"642, Main Road, Kovaipudur, Coimbatore - 641040",9:00 AM to 11:00 PM,3,2390
1027,Geetha Canteen Bhavan,Peelamedu,South Indian,$,512,Family-style,3.7,"Pongal, Vada, Masala Dosa",Yes,Yes,No,0422-255069,"927, Opposite CIT College, Peelamedu, Coimbatore - 641084",7:00 AM to 12:00 AM,13,3957
1028,Dragon Gate Family Restaurant,Peelamedu,South Indian,$$,1198,Casual,4.4,"Filter Coffee, Kesari Bath, Masala Dosa",Yes,Yes,No,0422-261261,"638, Near Airport, Peelamedu, Coimbatore - 641078",7:00 AM to 11:00 PM,19,4673
1029,Kovai Biryani Center Kitchen,Gandhipuram,Kerala,$,467,Casual,4.1,"Beef Fry, Malabar Parotta, Puttu Kadala",Yes,Yes,Yes,0422-255255,"855, Opposite Gandhipuram Bus Stand, Gandhipuram, Coimbatore - 641020",10:00 AM to 10:00 PM,24,4468
1030,Sree Annapoorna,Gopalapuram,South Indian,$$$,1841,Family-style,4.3,"Masala Dosa, Bisi Bele Bath, Idli Sambar, Filter Coffee",Yes,Yes,No,0422-228569,"477, Main Road, Gopalapuram, Coimbatore - 641099",9:00 AM to 11:00 PM,6,988
1031,Coimbatore Palace Restaurant,RS Puram,Biryani,$$$$,3811,Family-style,4.3,"Hyderabadi Biryani, Egg Biryani, Ambur Biryani, Mutton Biryani",Yes,Yes,Yes,0422-239529,"615, Near DB Road, RS Puram, Coimbatore - 641025",11:00 AM to 10:00 PM,12,4414
1032,Saravana Bhavan Restaurant,Saravanampatti,Chinese,$$$,3101,Traditional,5.0,"Manchurian, Schezwan Fried Rice, Spring Rolls",Yes,Yes,No,0422-268386,"277, Near Kovai Medical Center, Saravanampatti, Coimbatore - 641088",11:00 AM to 11:00 PM,15,3618
1033,Domino's Cafe,Saibaba Colony,Fast Food,$$,1383,Casual,4.2,"Sandwich, Nuggets, Hot Dog",Yes,No,Yes,0422-223834,"218, Near Coimbatore Institute of Technology, Saibaba Colony, Coimbatore - 641055",9:00 AM to 11:00 PM,9,4933
1034,Haribhavanam,Peelamedu,Andhra,$,543,Family-style,3.8,"Royyala Iguru, Pesarattu, Gongura Mutton, Pulihora",Yes,Yes,No,0422-229045,"709, Opposite CIT College, Peelamedu, Coimbatore - 641041",9:00 AM to 12:00 AM,19,3073
1035,Aasai Hotel Sweet Shop,Ukkadam,Chinese,$,418,Casual,4.5,"Chilli Chicken, Spring Rolls, Dumplings",No,Yes,Yes,0422-299901,"707, Main Road, Ukkadam, Coimbatore - 641033",8:00 AM to 10:00 PM,24,4016
1036,Royal Darbar Bakery,Saibaba Colony,North Indian,$$$$,4978,Casual,3.9,"Chole Bhature, Paneer Butter Masala",No,Yes,No,0422-207146,"300, Near Lakshmi Mills, Saibaba Colony, Coimbatore - 641099",8:00 AM to 12:00 AM,28,4071
1037,A2B,Gandhipuram,South Indian,$$,1763,Traditional,4.4,"Masala Dosa, Uttapam",No,Yes,Yes,0422-275631,"703, Near Brookefields Mall, Gandhipuram, Coimbatore - 641016",8:00 AM to 10:00 PM,26,4660
1038,Buhari Hotel,Gandhipuram,Mexican,$$$,2722,Modern,3.7,"Guacamole, Enchiladas, Burritos, Quesadilla",Yes,Yes,Yes,0422-274531,"62, Near Brookefields Mall, Gandhipuram, Coimbatore - 641088",7:00 AM to 10:00 PM,21,1778
1039,Buhari Hotel,Gandhipuram,North Indian,$,652,Family-style,3.8,"Rogan Josh, Biryani",Yes,Yes,Yes,0422-292141,"73, Opposite Gandhipuram Bus Stand, Gandhipuram, Coimbatore - 641097",8:00 AM to 11:00 PM,26,4881
1040,Taste of Kerala Family Restaurant,Ramanathapuram,Kerala,$$,861,Casual,4.3,"Kappa & Meen Curry, Malabar Parotta, Appam Stew",Yes,Yes,Yes,0422-237828,"450, Main Road, Ramanathapuram, Coimbatore - 641025",10:00 AM to 12:00 AM,10,3347
1041,Geetha Canteen Hotel,Singanallur,Mexican,$$$,1987,Casual,4.7,"Nachos, Guacamole, Enchiladas, Tacos",Yes,Yes,Yes,0422-202719,"784, Main Road, Singanallur, Coimbatore - 641096",9:00 AM to 12:00 AM,2,1485
1042,Copper Chimney Grill,Saibaba Colony,Chinese,$$$,2636,Casual,4.5,"Manchurian, Schezwan Fried Rice, Spring Rolls",Yes,Yes,Yes,0422-290921,"296, Near Coimbatore Institute of Technology, Saibaba Colony, Coimbatore - 641094",10:00 AM to 12:00 AM,2,3775
1043,Barbeque Nation,RS Puram,South Indian,$$,992,Family-style,4.3,"Masala Dosa, Kesari Bath, Vada, Bisi Bele Bath",Yes,Yes,Yes,0422-206764,"274, Near Race Course, RS Puram, Coimbatore - 641080",8:00 AM to 11:00 PM,15,4020
1044,Domino's Kitchen,Chinniampalayam,South Indian,$,347,Casual,4.1,"Bisi Bele Bath, Filter Coffee",Yes,Yes,Yes,0422-284896,"853, Main Road, Chinniampalayam, Coimbatore - 641029",10:00 AM to 12:00 AM,10,4218
1045,Madurai Kumar Mess Family Restaurant,Saravanampatti,Andhra,$$,1743,Family-style,3.6,"Royyala Iguru, Gongura Mutton",Yes,Yes,No,0422-254387,"957, Near KMCH Hospital, Saravanampatti, Coimbatore - 641074",9:00 AM to 10:00 PM,10,2495
1046,Dindigul Thalappakatti Barbecue,Saibaba Colony,Bakery & Cafe,$$$,2459,Modern,4.1,"Cold Coffee, Tea, Donut",Yes,Yes,Yes,0422-253841,"326, Near PSG Tech, Saibaba Colony, Coimbatore - 641070",10:00 AM to 11:00 PM,22,1296
1047,Coimbatore Palace Sweet Shop,Gandhipuram,Chinese,$$$,1831,Traditional,4.3,"Manchurian, Chilli Chicken, Schezwan Fried Rice",Yes,Yes,No,0422-261537,"347, Opposite Gandhipuram Bus Stand, Gandhipuram, Coimbatore - 641089",10:00 AM to 12:00 AM,3,2741
1048,McDonald's Darbar,Vadavalli,Bakery & Cafe,$$,1446,Casual,4.6,"Cappuccino, Donut",Yes,Yes,No,0422-212903,"779, Main Road, Vadavalli, Coimbatore - 641091",7:00 AM to 11:00 PM,6,2503
1049,Subway Ice Cream Parlor,Gandhipuram,Vegetarian,$$,1221,Family-style,4.4,"Paneer Tikka, Aloo Gobi",Yes,Yes,No,0422-250140,"700, Near Brookefields Mall, Gandhipuram, Coimbatore - 641040",10:00 AM to 12:00 AM,5,1952
1050,Annapoorna,RS Puram,Chinese,$$$,2123,Casual,3.8,"Chilli Chicken, Hot & Sour Soup, American Chopsuey",Yes,Yes,No,0422-255615,"257, Near DB Road, RS Puram, Coimbatore - 641068",9:00 AM to 10:00 PM,13,4008
1051,Subway Bakery,Saravanampatti,South Indian,$,742,Family-style,4.3,"Filter Coffee, Uttapam, Masala Dosa, Kesari Bath",Yes,Yes,Yes,0422-265107,"795, Near KMCH Hospital, Saravanampatti, Coimbatore - 641039",11:00 AM to 11:00 PM,8,1607
1052,Rasam Bhavan,Saibaba Colony,Chettinad,$$$,1868,Family-style,4.2,"Kola Urundai, Chettinad Chicken, Fish Fry, Karaikudi Mutton",Yes,No,No,0422-297973,"180, Near Coimbatore Institute of Technology, Saibaba Colony, Coimbatore - 641035",8:00 AM to 12:00 AM,29,3047
1053,KFC Darbar,Sitra,Italian,$$$$,5418,Modern,4.1,"Tiramisu, Bruschetta, Pizza Margherita",No,Yes,Yes,0422-294924,"691, Main Road, Sitra, Coimbatore - 641060",11:00 AM to 11:00 PM,3,3282
1054,The Eatery Fast Food,Ukkadam,South Indian,$$,1282,Casual,4.4,"Rava Dosa, Idli Sambar, Bisi Bele Bath, Kesari Bath",Yes,Yes,Yes,0422-229015,"664, Main Road, Ukkadam, Coimbatore - 641018",10:00 AM to 12:00 AM,10,3394
1055,A2B,Gandhipuram,South Indian,$$,1197,Family-style,4.7,"Bisi Bele Bath, Pongal",Yes,Yes,Yes,0422-254935,"761, Near Brookefields Mall, Gandhipuram, Coimbatore - 641029",10:00 AM to 12:00 AM,4,4058
1056,Copper Chimney,Ramanathapuram,Chettinad,$,350,Modern,4.6,"Pepper Chicken, Karaikudi Mutton, Fish Fry",Yes,Yes,Yes,0422-207936,"408, Main Road, Ramanathapuram, Coimbatore - 641045",8:00 AM to 10:00 PM,28,3775
1057,Sree Annapoorna Hotel,RS Puram,South Indian,$$$,1940,Traditional,4.2,"Pongal, Vada",Yes,Yes,Yes,0422-230539,"793, Opposite PSG College, RS Puram, Coimbatore - 641028",11:00 AM to 10:00 PM,9,1235
1058,A2B Restaurant,Ukkadam,Fusion,$$$,1832,Casual,4.3,"Paneer Tikka Pizza, Curry Pizza, Biryani Burrito",No,Yes,Yes,0422-297735,"66, Main Road, Ukkadam, Coimbatore - 641070",10:00 AM to 11:00 PM,17,4913
1059,Junior Kuppanna Bakery,Singanallur,South Indian,$$,1667,Family-style,4.3,"Masala Dosa, Kesari Bath",Yes,Yes,Yes,0422-209632,"921, Main Road, Singanallur, Coimbatore - 641020",9:00 AM to 12:00 AM,5,588
1060,McDonald's Juice Center,Saibaba Colony,South Indian,$$$$,5262,Casual,4.8,"Uttapam, Kesari Bath, Bisi Bele Bath, Filter Coffee",Yes,Yes,Yes,0422-272264,"887, Near Lakshmi Mills, Saibaba Colony, Coimbatore - 641037",10:00 AM to 11:00 PM,29,1921
1061,Anjappar Sweet Shop,Thudiyalur,Chinese,$$,868,Casual,4.0,"Chilli Chicken, Spring Rolls, Manchurian, Schezwan Fried Rice",No,Yes,Yes,0422-248843,"832, Main Road, Thudiyalur, Coimbatore - 641026",11:00 AM to 10:00 PM,19,4650
1062,Rasam Grill,Saibaba Colony,Chettinad,$$$,2012,Family-style,4.3,"Chettinad Chicken, Fish Fry, Prawn Masala, Karaikudi Mutton",Yes,Yes,No,0422-214184,"866, Near Coimbatore Institute of Technology, Saibaba Colony, Coimbatore - 641081",9:00 AM to 10:00 PM,25,2332
1063,Mughal Darbar Restaurant,Thudiyalur,Chettinad,$$,1079,Traditional,3.8,"Kola Urundai, Fish Fry, Chettinad Chicken, Pepper Chicken",Yes,Yes,No,0422-218776,"580, Main Road, Thudiyalur, Coimbatore - 641094",10:00 AM to 10:00 PM,5,301
1064,Kovai Biryani Center Sweet Shop,Ukkadam,South Indian,$,379,Casual,3.7,"Rava Dosa, Idli Sambar, Masala Dosa",Yes,Yes,No,0422-286761,"435, Main Road, Ukkadam, Coimbatore - 641072",11:00 AM to 11:00 PM,14,2287
1065,A2B Bakery,Ukkadam,South Indian,$$,1204,Modern,4.5,"Kesari Bath, Uttapam, Masala Dosa, Idli Sambar",No,Yes,Yes,0422-217987,"783, Main Road, Ukkadam, Coimbatore - 641042",9:00 AM to 11:00 PM,4,113
1066,Buhari Hotel,Saravanampatti,Chinese,$$,1246,Casual,4.7,"Hot & Sour Soup, Hakka Noodles, Schezwan Fried Rice, Dumplings",Yes,Yes,Yes,0422-275156,"727, Near KMCH Hospital, Saravanampatti, Coimbatore - 641091",10:00 AM to 11:00 PM,4,3368
1067,Mughal Darbar Barbecue,Peelamedu,South Indian,$$$,2016,Casual,4.4,"Idli Sambar, Filter Coffee, Kesari Bath",Yes,Yes,Yes,0422-240668,"348, Near Hope College, Peelamedu, Coimbatore - 641038",9:00 AM to 10:00 PM,3,4231
1068,Barbeque Nation,Ukkadam,Kerala,$,352,Casual,4.6,"Kappa & Meen Curry, Fish Curry, Malabar Parotta, Kerala Sadya",No,Yes,Yes,0422-285918,"78, Main Road, Ukkadam, Coimbatore - 641032",10:00 AM to 11:00 PM,25,4668
1069,Sree Gowri Shankar Sweet Shop,Singanallur,Biryani,$$$,2760,Family-style,4.5,"Prawn Biryani, Mutton Biryani, Egg Biryani, Chicken Biryani",Yes,Yes,No,0422-266497,"76, Main Road, Singanallur, Coimbatore - 641049",10:00 AM to 11:00 PM,2,516
1070,Geetha Canteen Juice Center,Peelamedu,North Indian,$$,1129,Family-style,3.9,"Butter Chicken, Biryani, Chole Bhature, Paneer Butter Masala",Yes,Yes,Yes,0422-245015,"87, Near Hope College, Peelamedu, Coimbatore - 641074",8:00 AM to 10:00 PM,8,3636
1071,The French Door Ice Cream Parlor,Ukkadam,Desserts,$$$,3190,Family-style,4.5,"Kulfi, Falooda, Ice Cream Sundae",Yes,Yes,No,0422-212387,"572, Main Road, Ukkadam, Coimbatore - 641096",10:00 AM to 11:00 PM,9,4987
1072,Dindigul Thalappakatti Ice Cream Parlor,Peelamedu,Multi-Cuisine,$,604,Traditional,4.8,"Dessert Platter, Mocktails, Biryani, Grilled Chicken",No,Yes,Yes,0422-243054,"687, Near Airport, Peelamedu, Coimbatore - 641099",11:00 AM to 10:00 PM,21,3518
1073,AB's Absolute Barbecues Sweet Shop,Gandhipuram,Italian,$$$$,4134,Casual,4.5,"Risotto, Pasta Alfredo, Bruschetta",Yes,Yes,Yes,0422-296815,"39, Near Brookefields Mall, Gandhipuram, Coimbatore - 641094",9:00 AM to 12:00 AM,5,4942
1074,Mughal Darbar Kitchen,RS Puram,North Indian,$$$,3185,Traditional,5.0,"Rogan Josh, Naan",Yes,Yes,Yes,0422-258841,"547, Near Race Course, RS Puram, Coimbatore - 641040",9:00 AM to 11:00 PM,29,1639
1075,Kovai Biryani Center Bakery,PN Palayam,North Indian,$$$,2083,Traditional,3.4,"Rogan Josh, Paneer Butter Masala, Tandoori Chicken, Chole Bhature",No,Yes,Yes,0422-213446,"729, Main Road, PN Palayam, Coimbatore - 641076",7:00 AM to 11:00 PM,3,1363
1076,Anjappar,Sitra,North Indian,$,776,Casual,4.5,"Tandoori Chicken, Naan",No,Yes,No,0422-210696,"384, Main Road, Sitra, Coimbatore - 641038",7:00 AM to 11:00 PM,30,861
1077,Buhari Hotel Hotel,Saibaba Colony,Bakery & Cafe,$$,1430,Cafe-style,4.2,"Croissant, Cookies, Donut",No,Yes,Yes,0422-271932,"624, Near Lakshmi Mills, Saibaba Colony, Coimbatore - 641077",10:00 AM to 10:00 PM,25,2410
1078,Sri Krishna Sweets,Gandhipuram,South Indian,$$$,2823,Family-style,4.4,"Idli Sambar, Bisi Bele Bath, Filter Coffee",No,Yes,No,0422-218818,"440, Opposite Gandhipuram Bus Stand, Gandhipuram, Coimbatore - 641010",11:00 AM to 11:00 PM,8,4724
1079,Geetha Canteen,Saibaba Colony,Chinese,$,625,Casual,4.2,"Hakka Noodles, Schezwan Fried Rice, Dumplings, American Chopsuey",Yes,Yes,Yes,0422-208855,"247, Near Coimbatore Institute of Technology, Saibaba Colony, Coimbatore - 641094",7:00 AM to 12:00 AM,24,2773
1080,Namma Veedu Kitchen,Peelamedu,South Indian,$$$,3461,Casual,3.6,"Kesari Bath, Bisi Bele Bath, Rava Dosa, Idli Sambar",Yes,Yes,No,0422-226422,"811, Near Airport, Peelamedu, Coimbatore - 641035",7:00 AM to 11:00 PM,30,2590
1081,KFC Hotel,Kalapatti,Italian,$$$,3399,Casual,4.3,"Garlic Bread, Lasagna",Yes,Yes,Yes,0422-257272,"911, Main Road, Kalapatti, Coimbatore - 641061",10:00 AM to 11:00 PM,11,1580
1082,Sri Sabareesh Fast Food,Singanallur,Chinese,$$$,3484,Casual,4.5,"Dumplings, Hakka Noodles, Schezwan Fried Rice, Chilli Chicken",Yes,Yes,Yes,0422-238750,"314, Main Road, Singanallur, Coimbatore - 641067",11:00 AM to 12:00 AM,14,1415
1083,AB's Absolute Barbecues,Peelamedu,Andhra,$$$,3174,Family-style,5.0,"Royyala Iguru, Pulihora, Andhra Chicken Curry, Pesarattu",Yes,Yes,Yes,0422-204081,"870, Near Airport, Peelamedu, Coimbatore - 641087",10:00 AM to 10:00 PM,5,600
1084,Sree Gowri Shankar Hotel,Saibaba Colony,South Indian,$$$,3362,Casual,4.2,"Kesari Bath, Rava Dosa, Pongal, Vada",No,Yes,Yes,0422-236528,"984, Near PSG Tech, Saibaba Colony, Coimbatore - 641024",7:00 AM to 12:00 AM,6,4138
1085,Barbeque Nation,Sitra,Italian,$,655,Modern,3.9,"Risotto, Garlic Bread, Lasagna",Yes,Yes,Yes,0422-259250,"177, Main Road, Sitra, Coimbatore - 641066",7:00 AM to 12:00 AM,28,2668
1086,Subway Bakery,Avinashi Road,Kerala,$$$,2841,Casual,4.2,"Fish Curry, Kappa & Meen Curry, Malabar Parotta, Beef Fry",Yes,Yes,No,0422-264752,"27, Main Road, Avinashi Road, Coimbatore - 641056",11:00 AM to 12:00 AM,12,3878
1087,Geetha Canteen Cafe,Ukkadam,Fast Food,$,721,Casual,4.6,"Hot Dog, Wrap, Sandwich, Fried Chicken",No,Yes,No,0422-261057,"697, Main Road, Ukkadam, Coimbatore - 641076",9:00 AM to 10:00 PM,29,4566
1088,Noodle Bar Hotel,RS Puram,Kerala,$$$,2460,Modern,4.6,"Malabar Parotta, Beef Fry, Kappa & Meen Curry, Kerala Sadya",Yes,Yes,Yes,0422-237230,"257, Near Race Course, RS Puram, Coimbatore - 641035",11:00 AM to 11:00 PM,5,2530
1089,Coimbatore Palace Bhavan,Gandhipuram,Chettinad,$$,842,Traditional,4.1,"Kola Urundai, Prawn Masala, Fish Fry, Pepper Chicken",No,No,Yes,0422-275598,"667, Opposite Gandhipuram Bus Stand, Gandhipuram, Coimbatore - 641036",11:00 AM to 11:00 PM,20,298
1090,Arya Bhavan,Saibaba Colony,Chinese,$$,1505,Casual,4.4,"Dumplings, Spring Rolls, Schezwan Fried Rice, Hakka Noodles",Yes,Yes,No,0422-279516,"321, Near PSG Tech, Saibaba Colony, Coimbatore - 641050",9:00 AM to 11:00 PM,5,3085
1091,Sree Annapoorna,Gandhipuram,Italian,$$,851,Casual,4.3,"Lasagna, Pizza Margherita",Yes,Yes,No,0422-220932,"957, Opposite Gandhipuram Bus Stand, Gandhipuram, Coimbatore - 641083",9:00 AM to 10:00 PM,25,1355
1092,Taco Bell Darbar,Ukkadam,Chinese,$,598,Casual,4.6,"American Chopsuey, Manchurian, Dumplings",No,Yes,Yes,0422-285755,"689, Main Road, Ukkadam, Coimbatore - 641070",9:00 AM to 12:00 AM,1,930
1093,Black Pearl Ice Cream Parlor,Kovaipudur,Chinese,$,583,Casual,3.9,"Schezwan Fried Rice, Spring Rolls",Yes,Yes,Yes,0422-281689,"697, Main Road, Kovaipudur, Coimbatore - 641088",7:00 AM to 10:00 PM,4,3276
1094,The French Door Bhavan,Kalapatti,North Indian,$,319,Casual,4.1,"Rogan Josh, Chole Bhature, Butter Chicken, Dal Makhani",Yes,Yes,Yes,0422-279463,"915, Main Road, Kalapatti, Coimbatore - 641075",8:00 AM to 11:00 PM,30,2659
1095,Taco Bell Sweet Shop,Perur,South Indian,$$,1106,Family-style,4.0,"Bisi Bele Bath, Kesari Bath, Rava Dosa, Uttapam",No,Yes,No,0422-254596,"598, Main Road, Perur, Coimbatore - 641049",7:00 AM to 12:00 AM,16,2225
1096,Sree Gowri Shankar Family Restaurant,Avinashi Road,Arabian,$$,951,Traditional,3.6,"Kebab, Falafel, Mandi, Baklava",Yes,Yes,Yes,0422-225006,"20, Main Road, Avinashi Road, Coimbatore - 641066",9:00 AM to 11:00 PM,5,3432
1097,Madurai Kumar Mess Hotel,Saravanampatti,Andhra,$$,1289,Family-style,4.3,"Gongura Mutton, Gutti Vankaya, Pulihora, Royyala Iguru",Yes,Yes,Yes,0422-244869,"363, Near Kovai Medical Center, Saravanampatti, Coimbatore - 641096",9:00 AM to 12:00 AM,16,1625
1098,Arya Bhavan,Peelamedu,Continental,$$$$,5465,Fine Dining,4.5,"Steak, Bruschetta, Fish & Chips, Caesar Salad",Yes,Yes,No,0422-215974,"693, Near Hope College, Peelamedu, Coimbatore - 641079",10:00 AM to 11:00 PM,27,2877
1099,Arya Bhavan,Thudiyalur,Continental,$$$$,6186,Fine Dining,4.4,"Caesar Salad, Fish & Chips",Yes,Yes,Yes,0422-273664,"713, Main Road, Thudiyalur, Coimbatore - 641044",8:00 AM to 10:00 PM,20,4857
1100,Pizza Hut Family Restaurant,Gandhipuram,South Indian,$,648,Traditional,4.2,"Rava Dosa, Kesari Bath, Masala Dosa",No,Yes,Yes,0422-253334,"958, Near Brookefields Mall, Gandhipuram, Coimbatore - 641070",10:00 AM to 12:00 AM,7,2403
1101,Geetha Canteen Family Restaurant,Saibaba Colony,North Indian,$$$,1874,Modern,3.8,"Butter Chicken, Paneer Butter Masala, Biryani, Rogan Josh",Yes,Yes,Yes,0422-237941,"10, Near PSG Tech, Saibaba Colony, Coimbatore - 641048",11:00 AM to 12:00 AM,4,2794
1102,Rathna Cafe Bhavan,Kalapatti,North Indian,$$$,2477,Casual,4.2,"Chole Bhature, Paneer Butter Masala, Butter Chicken",Yes,Yes,No,0422-296549,"346, Main Road, Kalapatti, Coimbatore - 641047",11:00 AM to 12:00 AM,25,1632
1103,Noodle Bar Sweet Shop,Vadavalli,South Indian,$,465,Modern,4.1,"Idli Sambar, Pongal, Bisi Bele Bath, Vada",No,Yes,Yes,0422-234995,"977, Main Road, Vadavalli, Coimbatore - 641052",9:00 AM to 12:00 AM,24,4743
1104,Haribhavanam Mess,Saibaba Colony,South Indian,$$,1506,Casual,3.9,"Filter Coffee, Uttapam",Yes,Yes,Yes,0422-228721,"490, Near PSG Tech, Saibaba Colony, Coimbatore - 641029",10:00 AM to 12:00 AM,20,3110
1105,Taste of Kerala Dhaba,Ukkadam,Chinese,$$$,3241,Casual,4.3,"Manchurian, Chilli Chicken, Schezwan Fried Rice, Dumplings",Yes,Yes,Yes,0422-266255,"208, Main Road, Ukkadam, Coimbatore - 641083",11:00 AM to 10:00 PM,6,2737
1106,Coimbatore Palace Darbar,Singanallur,Bakery & Cafe,$,562,Cafe-style,4.4,"Cookies, Chocolate Cake, Donut, Cappuccino",Yes,Yes,Yes,0422-240392,"741, Main Road, Singanallur, Coimbatore - 641012",10:00 AM to 11:00 PM,27,74
1107,Geetha Canteen,Ukkadam,Biryani,$$,1093,Family-style,5.0,"Chicken Biryani, Ambur Biryani, Egg Biryani, Hyderabadi Biryani",Yes,Yes,Yes,0422-284656,"987, Main Road, Ukkadam, Coimbatore - 641063",9:00 AM to 11:00 PM,15,3142
1108,Taste of Kerala Bhavan,Saibaba Colony,North Indian,$$$,2604,Family-style,4.5,"Paneer Butter Masala, Tandoori Chicken, Chole Bhature",Yes,Yes,No,0422-202979,"475, Near Coimbatore Institute of Technology, Saibaba Colony, Coimbatore - 641096",11:00 AM to 11:00 PM,18,3157
1109,Burger King Dhaba,RS Puram,Fast Food,$$$$,6018,Takeaway Only,4.6,"French Fries, Chicken Burger, Fried Chicken, Sandwich",Yes,No,No,0422-213224,"35, Near DB Road, RS Puram, Coimbatore - 641067",11:00 AM to 12:00 AM,23,448
1110,Taste of Kerala Dhaba,Gandhipuram,North Indian,$$$,2392,Casual,4.5,"Naan, Chole Bhature",Yes,Yes,Yes,0422-288150,"243, Opposite Gandhipuram Bus Stand, Gandhipuram, Coimbatore - 641048",8:00 AM to 12:00 AM,17,1860
1111,Coimbatore Palace Kitchen,Peelamedu,Chinese,$$,1764,Family-style,3.4,"American Chopsuey, Hakka Noodles, Spring Rolls",Yes,Yes,Yes,0422-253511,"308, Near Airport, Peelamedu, Coimbatore - 641058",8:00 AM to 12:00 AM,16,2024
1112,Kovai Biryani Center Hotel,Peelamedu,Bakery & Cafe,$,424,Cafe-style,4.2,"Brownie, Croissant, Donut",Yes,No,Yes,0422-248637,"549, Near Airport, Peelamedu, Coimbatore - 641034",7:00 AM to 11:00 PM,13,4989
1113,Coimbatore Palace Dhaba,Gandhipuram,South Indian,$$,1759,Casual,4.3,"Uttapam, Masala Dosa, Idli Sambar",Yes,Yes,Yes,0422-231797,"619, Near Brookefields Mall, Gandhipuram, Coimbatore - 641036",10:00 AM to 10:00 PM,18,2684
1114,Kumarakom Bakery,Saravanampatti,Biryani,$,689,Traditional,5.0,"Egg Biryani, Ambur Biryani, Chicken Biryani, Hyderabadi Biryani",Yes,Yes,Yes,0422-273731,"760, Near Karunya University, Saravanampatti, Coimbatore - 641028",7:00 AM to 11:00 PM,18,4834
1115,Geetha Canteen,Saravanampatti,Chettinad,$,690,Traditional,4.1,"Karaikudi Mutton, Pepper Chicken, Fish Fry, Kola Urundai",Yes,Yes,Yes,0422-222050,"815, Near Kovai Medical Center, Saravanampatti, Coimbatore - 641055",8:00 AM to 10:00 PM,24,4527
1116,Namma Veedu Hotel,Sitra,Chinese,$$,806,Family-style,4.3,"Hakka Noodles, Dumplings",Yes,Yes,Yes,0422-201198,"224, Main Road, Sitra, Coimbatore - 641074",10:00 AM to 11:00 PM,2,4008
